<?xml version="1.0" encoding="UTF-8"?>
<!DOCTYPE arena SYSTEM "arena.dtd">
<arena>
    <edicion>2026</edicion>
    <fecha>2026-06-15</fecha>
    <sede>Costa del Sol</sede>
    
    <torneo id="SA-001">
        <nombre>Torneo Voley Playa STEM</nombre>
        <categoria>Senior</categoria>
        <plazas>32</plazas>
        
        <equipos>
            <equipo color="rojo">
                <nombre>Los Titanes</nombre>
                <pais>Espa√±a</pais>
            </equipo>
            <equipo color="azul">
                <nombre>Night Owls</nombre>
                <pais>Portugal</pais>
            </equipo>
        </equipos>
        
        <resultado ganador="Los Titanes">2-1</resultado>
    </torneo>
</arena>